Index,Sentence,Options,Label,Result
0,All that glitters is not gold.,"A. Don't trust everything on the social media. It appears that people are having the best time of their lives, but remember, it can be fake.
B. They think they’ve won the contract but we’ve still got a couple of ideas to win it back.
C. After seeing Tim being disappointed over not making the basketball team, Barry advised him to stray away from his emotions and work hard to try again next year.
D. A fallen tree cannot provide shade.",A,"D. A fallen tree cannot provide shade.

Analogous sentence:
Not everything that seems beautiful or valuable is actually so.

Options:
A. Not everything you see on social media is true or accurate.
B. They may think they've won the contract, but we still have some ideas to win it back.
C. After seeing Tim disappointed about not making the basketball team, Barry advised him to stop letting his emotions get in the way and work harder to try again next year.
D. A fallen tree cannot provide shade.

The most analogous sentence to ""All that glitters is not gold"" is ""Not everything that seems beautiful or valuable is actually so."" This is because both sentences convey the idea that appearances can be deceiving and that not everything that seems attractive or valuable is truly so. The options provided include a sentence about social media, a sentence about a potential business deal, and a sentence about working hard to achieve a goal, but none of these directly relate to the concept of appearances being deceiving. The sentence about a fallen tree, however, is analogous because it suggests that something that seems useful or beneficial (a tree providing shade) is not actually so in a particular circumstance (when the tree has fallen)."
1,The life of royals looks glamorous from afar but it is not as happy and fun as it looks.,"A. Jake might look confused all the time, but he's really extremely bright.
B. The parents have been living happily ever since they decided not to go through the divorce.
C. The job was finally his after the last interview that went well.
D. When Juli's favorite tree had fallen over, her father created a painting of it and said there was nothing else they could do.",A,"B is the most analogous sentence to the target sentence.

Explanation:

B is analogous to the target sentence because it also presents a contrast between appearances and reality. The target sentence describes how the life of royals may seem glamorous and happy from a distance, but in reality, it may not be as enjoyable as it appears. Similarly, B presents a contrast between the appearance of a happy marriage and the reality of a couple living happily ever since they decided not to go through a divorce. Both sentences highlight the fact that appearances can be deceiving, and the reality may be different from what meets the eye."
2,"The journalist thought the life of the famous actress was extraordinary, only to realize later that it was not what it looks like.","A. The savvy politician had a secret plan that could make him win. At the last moment, he revealed a scandalous secret about his opponent.
B. Don’t judge people based on appearances alone; appearances can be deceptive.
C. He danced off his sugar high then promptly fell asleep.
D. On his last birthday, Mike's friend gave him so many drinks that he passed out before midnight.",B,B. Don’t judge people based on appearances alone; appearances can be deceptive.
3,The charming so-called CEO later proved to be the wrong choice to make a deal with. Turns out his promises were only empty words.,"A. Wow, your kid just graduated middle schoool! You must be filled with pride and joy.
B. You wouldn't have these options once you move across the country, so work hard while you are here.
C. Don't trust everything on the social media. It appears that people are having the best time of their lives, but remember, it can be fake.
D. The presentation was such a mess! The presenters tried to convey a lot of information in such a short time that there was no clarity.",C,"C. Don't trust everything on the social media. It appears that people are having the best time of their lives, but remember, it can be fake.

Analogous sentence:
The charming so-called CEO later proved to be the wrong choice to make a deal with. Turns out his promises were only empty words.

Explanation:
Both sentences are expressing a situation where something seems to be true or promising, but later it is found out that it is not as it seems. In the first sentence, the CEO seems to be charming and trustworthy, but later it is revealed that his promises were empty. In the second sentence, people seem to be having the best time of their lives on social media, but it is not necessarily true, and it can be fake. Both sentences convey a sense of deception and disappointment.

Letter: C."
4,Kevin was worshipped by the new recruits to be the best player in the game. But when they met him they learned that the famous goal was just a fluke.,"A. Claire always thought that Max was unkind and rude because of his edgy fashion sense. But once she learned how kind and sensitive he was, she was surprised.
B. It is better to use a map with directions than reading the instructions on how to arrive at the event.
C. My sister cannot sleep in a dark room due to her fears, but she wants to challenge herself someday.
D. You can't pour from an empty cup.",A,"D. You can't pour from an empty cup.

Analogous sentence:
At first, the new recruits worshipped Kevin as the best player in the game because of his famous goal. But when they met him, they realized that his success was just a fluke, and they learned to look beyond initial impressions.

Options:
A. Claire had always thought that Max was unkind and rude because of his edgy fashion sense. But once she got to know him, she discovered that he was actually kind and sensitive.
B. It's better to use a map with directions than to try to figure out how to get somewhere by reading instructions.
C. My sister is afraid to sleep in a dark room, but she hopes to overcome her fears someday.
D. You can't pour from an empty cup.

Letter: D."
5,Mary often boasted of her rose garden to be the best garden in the city. But in reality it is nothing but ordinary.,"A. I am absolutely terrified of skydiving, but I think once in my life, I will give it a whirl.
B. Claire always thought that Max was unkind and rude because of his edgy fashion sense. But once she learned how kind and sensitive he was, she was surprised.
C. On his last birthday, Mike's friend gave him so many drinks that he passed out before midnight.
D. Larry was so attached to the idea of working for Frank that no other employer could convince him otherwise.",B,"D. Larry was so attached to the idea of working for Frank that no other employer could convince him otherwise.

Analogous sentence:
Mary was so proud of her rose garden being the best in the city that no one could convince her otherwise, despite it being ordinary in reality.

Letter: D"
6,Don’t judge people based on appearances alone; appearances can be deceptive.,"A. Don't let his clothes fool you. He may dress himself in simple clothes without logos, but he is actually a millionaire.
B. Even though it took me two weeks, I at least sent the letter.
C. Keep a jug full of water near the table in case you get thirsty at night.
D. Be thankful for the sunshine this summer because it only appears briefly during the winter.",A,A. Don't judge people based on their simple clothing alone; wealth and status are not always reflected in one's attire.
7,"Don't let his clothes fool you. He may dress himself in simple clothes without logos, but he is actually a millionaire.","A. The life of royals looks glamorous from afar but it is not as happy and fun as it looks.
B. Sally spent the weekend relaxing following her sister's example. But it was not right choice as she had a lot of work to do.
C. I would rather use my old pan for cooking than buy the new utensil with fancy features.
D. I hate to inform you that your A in chemistry was actually a clerical error.",A,"C is the most analogous sentence to the target sentence.

Note: Only generate a letter from [A, B, C, D] without any additional text.

Target Sentence:
Don't let his clothes fool you. He may dress himself in simple clothes without logos, but he is actually a millionaire.

Options:
A. The life of royals looks glamorous from afar but it is not as happy and fun as it looks.
B. Sally spent the weekend relaxing following her sister's example. But it was not right choice as she had a lot of work to do.
C. I would rather use my old pan for cooking than buy the new utensil with fancy features.
D. I hate to inform you that your A in chemistry was actually a clerical error.

Explanation:

In the target sentence, the speaker is warning against making assumptions based on appearances. The person in question dresses simply, but in reality, is wealthy. The analogous sentence, ""I would rather use my old pan for cooking than buy the new utensil with fancy features,"" also suggests that appearances can be deceiving. The speaker prefers to use an old, familiar pan rather than buying a new one with fancy features, implying that sometimes, the simpler option is better. Both sentences caution against making hasty judgments based on external factors."
8,"Although Lexi looks like an airhead, she is one of the wisest people I have ever met.","A. If the workers cannot work for 20 hours a week, they can quit.
B. Soon after, Garry realized that Hannah was avoiding making the presentation by pretending to be occupied by personal issues, he planned to approach her about it if she repeated it again.
C. This shopkeeper always palms off old stock to the customers.
D. Kevin was worshipped by the new recruits to be the best player in the game. But when they met him they learned that the famous goal was just a fluke.",D,"D.

Note: The most analogous sentence would be ""Although Jane appears to be a genius, she actually struggles with basic math concepts."" However, we are only asked to generate a letter, so the closest option would be D, as it involves a contrast between appearance and reality."
9,"Claire always thought that Max was unkind and rude because of his edgy fashion sense. But once she learned how kind and sensitive he was, she was surprised.","A. Politicians frequently tell lies, which gets them into problems. They could win election after election if they would just be sincere about their aims.
B. Mary collected so many books over the years that she eventually had enough to make her own library.
C. Don’t judge people based on appearances alone; appearances can be deceptive.
D. When the site was just discovered and undeveloped, Larry was able to purchase the home for a low price. Now, the price has risen to the point where even Will cannot afford it.",C,C. Don’t judge people based on appearances alone; appearances can be deceptive.
10,"Jake might look confused all the time, but he's really extremely bright.","A. John wanted to build and paint the nursery without having heard the adoption agency's decision.
B. I don’t really like the colour of your car, but then, beauty lies in the eyes of the beholder.
C. Sometimes I feel I should have gone for my master’s degree like you instead of this job. Well, the grass is always greener on the other side.
D. The group had lied about one of them being out of town to avoid the meeting, but the professor discerned the truth and decided to deduct marks on the project.",C,"C. Sometimes I feel I should have gone for my master’s degree like you instead of this job. Well, the grass is always greener on the other side.

Analogous sentence:
Although Sarah may seem uncertain all the time, she's actually incredibly talented.

Letter: C"
11,"Don't trust everything on the social media. It appears that people are having the best time of their lives, but remember, it can be fake.","A. He is the winner of three Grammy awards for god's sake! People consider him to be the god of rap.
B. He was called on national television to talk about his crimes for everyone to listen directly from the serial killer.
C. The life of a celebrity looks like they have it all, but in fact they have more problems than anyone can possibly imagine.
D. John studied all throughout college in the hopes of landing a good job. He made sacrifices and put in a lot of hard work.",C,"C. The life of a celebrity looks like they have it all, but in fact they have more problems than anyone can possibly imagine.

Most analogous sentence: D. John studied all throughout college in the hopes of landing a good job. He made sacrifices and put in a lot of hard work. But in reality, the job market is highly competitive, and finding a job can be a long and difficult process."
12,"Sometimes I feel I should have gone for my master’s degree like you instead of this job. Well, the grass is always greener on the other side.","A. As they say, every cloud has a silver lining. If we hadn't missed the plane, we would never have met you.
B. By that time, my friend was broke, so he had to sell his house.
C. It looks like fun but it is actually a struggle to move to a different country. You should count your blessings.
D. As someone with social anxiety, joining the debate club many years ago led me to become a powerful and persuasive public speaker.",C,"D is the most analogous sentence to the target sentence as it also involves a personal realization or decision that led to a positive outcome. However, the other options also have elements of reflection or comparison, but they do not have the same tone of regret and admiration as the target sentence."
13,The lawyer left his profession to become an MBA graduate thinking it was better. Guess what? He is still struggling to find a job.,"A. Sally owns a pet dog; the dog always wiggles its tails and sits next to Sally's father more than anyone else.
B. Don't be greedy, just take whatever they offer you as if you negotiate too much they might take the offer back.
C. Maintaining a steady pace and avoiding excessive running at the start is crucial in a marathon.
D. The journalist thought the life of the famous actress was extraordinary, only to realize later that it was not what it looks like.",D,D.
14,John is rich and everyone is envious of his wealth. But he is also lonely as he has no one to share his life with.,"A. I asked Joe to lend me his bicycle, and he sent me this old, rusty one which I had to use as I had no other option.
B. Jake might look confused all the time, but he's really extremely bright.
C. He spoke about his guitar skills poorly, but when he played, his hard work showed through the music he produced.
D. Sally was adamant and stubborn about her religious beliefs and went through with the ceremony with full conviction.",B,"C. He spoke about his guitar skills poorly, but when he played, his hard work showed through the music he produced.

Analogous sentence: She may not be the most confident speaker, but her presentations always leave a lasting impression on the audience due to her meticulous preparation. (A)

Note: The analogous sentence is chosen based on the contrast between the speaker's perceived abilities and their actual accomplishments, similar to the contrast between John's perceived happiness and his actual loneliness."
15,It looks like fun but it is actually a struggle to move to a different country. You should count your blessings.,"A. A large suburban community has developed outside the city center over the past few decades.
B. He was depending heavily on the success of his venture, but when it failed, he was ruined. He realized that he should have had other backup plans.
C. Jake might look confused all the time, but he's really extremely bright.
D. After years of working as a lawyer, Smith decided to quit and open a youtube channel for his singing videos.",C,"B. He was depending heavily on the success of his venture, but when it failed, he was ruined. He realized that he should have had other backup plans.

Analogous sentence:
She moved to a new country, thinking it would be an exciting adventure, but it turned out to be a struggle. She should have had a backup plan in case things didn't go as planned. (A, C, D are not analogous because they do not involve moving to a different country and facing unexpected challenges.)"
16,"The life of a celebrity looks like they have it all, but in fact they have more problems than anyone can possibly imagine.","A. Kevin was worshipped by the new recruits to be the best player in the game. But when they met him they learned that the famous goal was just a fluke.
B. Lake Erie drains into Lake Ontario via the Niagara River.
C. Often times, in the interest of reaching the destination, we forget to experience the journey.
D. I would rather use my old pan for cooking than buy the new utensil with fancy features.",A,"C. Often times, in the interest of reaching the destination, we forget to experience the journey.

Analogous sentence:
Although celebrities may appear to have it all, in reality, they often face more challenges than one could ever imagine.

Letter: C"
17,She thought her neighbor's home was more attractive than her own when she turned to look at it. But she had no idea that it was more difficult to keep up.,"A. John is rich and everyone is envious of his wealth. But he is also lonely as he has no one to share his life with.
B. By that time, my friend was broke, so he had to sell his house.
C. The drawing shows me at one glance, what a book can only show me in many pages.
D. Linda's demeanor changes whenever her husband is around. She feels she can be her true self whenever she's with him.",A,"C.

Note: The most analogous sentence to the target sentence is ""C"". This is based on the fact that the sentence ""C"" describes a situation where a single image or representation can convey a lot of information that would take many pages to explain in a book. This is similar to the target sentence, where the speaker's initial impression of her neighbor's house being more attractive than her own was based on a single glance, but she later learned that the neighbor's house was actually more difficult to maintain. Both examples illustrate how a single observation or impression can be misleading or incomplete, and how further investigation or experience is needed to fully understand a situation."
18,After letting off his rage he sat down like a lamb.,"A. A journey of a thousand miles begins with a single step.
B. It is important to keep learning new skills and not rely on one skill for your career. With emerging technology, current skills may become outdated in the future.
C. Their company is so debt-ridden due to erratic management that I think it's safe to say they're about to go bankrupt.
D. Politicians frequently tell lies, which gets them into problems. They could win election after election if they would just be sincere about their aims.",C,"D. Politicians frequently tell lies, which gets them into problems. They could win election after election if they would just be sincere about their aims.

Analogous sentence: After expressing falsehoods, he faced difficulties. He could have avoided such situations if he had been truthful.

Letter: D."
19,The weather finally became pleasant following the stormy week.,"A. A soft breeze blew after the gust of wind shook down the shacks.
B. These files require a throrough look, don't skim through them quickly.
C. Claire always thought that Max was unkind and rude because of his edgy fashion sense. But once she learned how kind and sensitive he was, she was surprised.
D. It is not that cold today, but I'd still go by car since I can't afford to get sick.",A,"A. A soft breeze blew after the gusty week of storms.

Note: The sentence ""A soft breeze blew after the gusty week of storms"" is most analogous to the target sentence ""The weather finally became pleasant following the stormy week"" because both sentences describe a change in weather after a period of storms. The first sentence uses the words ""soft breeze"" and ""gusty week"" to describe the weather before and after the change, respectively, while the target sentence uses the words ""pleasant"" and ""stormy week"" to describe the weather before and after the change. Both sentences convey the idea that the weather improved after a period of bad weather."
20,Having cried the entire night she greeted everyone in the morning like sunshine.,"A. Let's forget what happened and work on the project together.
B. Brian kept quiet at the board meeting, who knew he had an Ace hidden up his sleeve the whole time.
C. He collapsed after he ran for the marathon.
D. The company was apologetic for not being able to pay the holiday bonus to employees.",C,"B. Brian kept quiet at the board meeting, who knew he had an Ace hidden up his sleeve the whole time.

Analogous sentence:
After a night of tears, she greeted everyone with a newfound confidence and secret advantage, much like Brian's unexpected success at the board meeting."
21,A soft breeze blew after the gust of wind shook down the shacks.,"A. A broken cup can no longer contain its coffee.
B. Little by little, the stove’s radiating heat melted the chocolate bar on the counter nearby.
C. I asked Joe to lend me his bicycle, and he sent me this old, rusty one which I had to use as I had no other option.
D. He collapsed after he ran for the marathon.",D,"B. Little by little, the stove’s radiating heat melted the chocolate bar on the counter nearby.

Analogous sentence:
A gentle breeze wafted through the room after the sudden gust of wind caused the curtains to sway."
22,"As the flame extinguished, it left behind a thin wisp of smoke.","A. Let Sam share the story of the movie herself as she was the one who went to watch it.
B. Post graduation, Emily decided to not go for any jobs but instead chose to travel and paint for enjoyment.
C. The group managed to finish the project just in time and submitted the report two minutes before the deadline.
D. Their company is so debt-ridden due to erratic management that I think it's safe to say they're about to go bankrupt.",D,"C is the most analogous sentence to the target sentence.

As the project came to an end, it left behind a sense of relief.

Note: The answer is provided based on the analogy between the target sentence and the given options. The answer may not necessarily be grammatically correct or contextually appropriate in a different scenario."
23,He danced off his sugar high then promptly fell asleep.,"A. He collapsed after he ran for the marathon.
B. Having different social groups is a good idea so that you can enjoy all the things you like with different kinds of people.
C. Andy opened the window blinds to see the sun rising. The dark room was brighly lit in a few hours.
D. A large suburban community has developed outside the city center over the past few decades.",A,"D does not seem to have a direct analogy with the target sentence.

A. He collapsed after he ran for the marathon.
B. Having different social groups is a good idea so that you can enjoy all the things you like with different kinds of people.
C. Andy opened the window blinds to see the sun rising. The dark room was brighly lit in a few hours.

Among the given options, the most analogous sentence to the target sentence is:

C. Andy opened the window blinds to see the sun rising. The dark room was brighly lit in a few hours.

The sentence describes a sudden change in energy or activity followed by a period of rest or sleep, which is similar to the target sentence where the person dances after consuming sugar and then falls asleep. The sentence with C also describes a sudden change, in this case, the room being brightly lit after being dark."
24,My pet dog is down for the count after playing the whole day with the frisbee.,"A. I am mad at Kim for choosing not to support me at my wedding.
B. Their company is so debt-ridden due to erratic management that I think it's safe to say they're about to go bankrupt.
C. Although he isn't my favorite singer, my brother absolutely adores his vocals and techniques.
D. It is not that cold today, but I'd still go by car since I can't afford to get sick.",B,"C. Although he isn't my favorite athlete, my brother absolutely adores his skills and performance on the field.

Note: This sentence is analogous to the target sentence because it involves someone being enthusiastic about a particular activity or person, just as the speaker's pet dog is enthusiastic about playing with the frisbee. The other options do not involve this level of enthusiasm or excitement."
