Index,Sentence,Options,Label,Result
248,The company was apologetic for not being able to pay the holiday bonus to employees.,"A. The life of royals looks glamorous from afar but it is not as happy and fun as it looks.
B. Enjoy the honeymoon period of your marriage as much as you can before it passes.
C. I have had a great time in college, but tomorrow I will be graduating.
D. I do not want to spoil your mood but I have to babysit my nephew today.",D,"D is not analogous to the target sentence.

A. The life of royals looks glamorous from afar but it is not as happy and fun as it looks.

B. Enjoy the honeymoon period of your marriage as much as you can before it passes.

C. I have had a great time in college, but tomorrow I will be graduating.

None of these options are analogous to the target sentence.

In order to find an analogous sentence, we need to look for a situation where an entity is apologetic for not being able to fulfill an obligation or promise.

Here's an analogous sentence:

C. The event organizer apologized for not being able to provide the promised amenities due to unforeseen circumstances."
249,I do not want to spoil your mood but I have to babysit my nephew today.,"A. Let Sam share the story of the movie herself as she was the one who went to watch it.
B. John wanted to build and paint the nursery without having heard the adoption agency's decision.
C. I am sorry, but you would now have to present your work before you can go for the vacation.
D. The doctor had an important surgery the next day, so he asked the staff to not interrupt him with any minor tasks.",C,"D. The doctor had an important surgery the next day, so he asked the staff to not interrupt him with any minor tasks.

Most analogous sentence: C. I am sorry, but you would now have to present your work before you can go for the vacation.

Explanation: Both sentences convey a situation where the speaker has to inform someone about an unexpected or unwelcome situation that they have to deal with, which will prevent them from doing something they want to do. In the target sentence, the speaker has to babysit their nephew, which prevents them from doing something else (spoiling someone's mood). In the analogous sentence, the speaker has to ask someone to present their work before they can go on vacation, which prevents them from going on vacation immediately."
250,She's a representative of California for crying out loud! How do you not recognize her?.,"A. Don’t judge people based on appearances alone; appearances can be deceptive.
B. He is the winner of three Grammy awards for god's sake! People consider him to be the god of rap.
C. The corporation threw in more and more money to fix the problem.
D. Gary started investing his money and time in creating a small garden for himself during the off season. Gary regrets not planning and starting during the spring and summer season when results are more visible.",B,"B. Don't judge people based on appearances alone; appearances can be deceptive. (least analogous)

C. The corporation threw in more and more money to fix the problem. (least analogous)

D. Gary started investing his money and time in creating a small garden for himself during the off season. Gary regrets not planning and starting during the spring and summer season when results are more visible. (least analogous)

A. She's a representative of California for crying out loud! How do you not recognize her?. (most analogous)

B. He is the winner of three Grammy awards for god's sake! People consider him to be the god of rap. (second most analogous)

Letter: A or B (most analogous)

Note: The other options are least analogous to the target sentence."
251,Don't you know he is the president of the United States?!.,"A. Even if rain is on the forecast, keep watering your garden.
B. You wouldn't have these options once you move across the country, so work hard while you are here.
C. You must go immediately if you want to meet with the Senate. Otherwise, you'll struggle due to the traffic.
D. I cannot believe you don't know who Cristiano Ronaldo is! He is one of the greatest football players alive.",D,"D. I cannot believe you don't know who Cristiano Ronaldo is! He is one of the greatest football players alive.

Analogous sentence:
E. Don't you know who LeBron James is? He is one of the greatest basketball players of all time.

Letter: D or E

Explanation:
Both sentences express surprise that the person being addressed does not know the identity of a famous individual. The target sentence is about the President of the United States, and the analogous sentence is about a famous basketball player. Both sentences convey a sense of disbelief that the person being addressed is not aware of the identity of these prominent figures.

In terms of grammar and structure, both sentences follow a similar pattern of subject, verb, object, and exclamation mark. The target sentence is a statement of fact followed by an exclamatory statement, while the analogous sentence is a question followed by an exclamatory statement. However, both sentences convey the same meaning and level of surprise.

Therefore, the analogous sentence is ""E. Don't you know who LeBron James is? He is one of the greatest basketball players of all time.""

Letter: D or E

Answer: D or E

Explanation:
The answer is ""D"" for the target sentence and ""E"" for the analogous sentence."
252,I cannot believe you don't know who Cristiano Ronaldo is! He is one of the greatest football players alive.,"A. I am absolutely terrified of skydiving, but I think once in my life, I will give it a whirl.
B. Show some respect to your professor! He is a legend in his field.
C. The life of royals looks glamorous from afar but it is not as happy and fun as it looks.
D. I've heard that the defense lawyer has a fresh eyewitness who was previously unknown.",B,"B. Show some respect to your professor! He is a legend in his field.

Analogous sentence: C. Respect your doctor! She is a pioneer in her field.

Note: The analogous sentence is chosen based on the idea of recognizing and respecting someone who is highly regarded and accomplished in their respective fields."
253,Show some respect to your professor! He is a legend in his field.,"A. The father told the son that it was his way or the highway when the son came back home drunk.
B. The presentation was such a mess! The presenters tried to convey a lot of information in such a short time that there was no clarity.
C. He is the winner of three Grammy awards for god's sake! People consider him to be the god of rap.
D. Andy played hooky from work for a week saying he was sick, now he is on very thin ice according to his boss.",C,"C. Show some respect to your professor! He is a legend in his field.

Analogous sentence: D. Show some respect to your boss! She is a three-time winner of the Employee of the Year award.

Letter: C."
254,He is the winner of three Grammy awards for god's sake! People consider him to be the god of rap.,"A. Just because your roommate never cleans up after himself doesn't mean you should too.
B. In for a penny, in for a pound, we need to stay up all night and get the report done since we cannot turn it in half-finished.
C. When Chris turned forty, he decided to live his life in the fast lane and quit his job for his hobbies.
D. Don't you know he is the president of the United States?!.",D,"D. Don't you know he is the president of the United States?!.

Most analogous sentence:
She is widely regarded as the queen of pop music.

Options:
A. Just because your friend never returns your calls doesn't mean you should stop contacting her.
B. In for a penny, in for a pound, we need to finish this project since we cannot submit it halfway done.
C. When Sarah turned thirty, she decided to pursue her passion for art and quit her job.
D. Don't you know she is the winner of three Grammy awards?!.

Letter: D."
255,Do you know who you're facing? That's the world champion of taekwondo standing right there!.,"A. Every cigarette you smoked is a threat to your health.
B. Don't you know he is the president of the United States?!.
C. A picture of diseased lungs on the back of cigarette packs is more effective than just the statutory warning message.
D. We missed the bus, but it serves no use to be angry about it right now, so let's walk.",B,"C. A picture of diseased lungs on the back of cigarette packs is more effective than just the statutory warning message.

This sentence is most analogous to the target sentence because it highlights the impact and significance of a visual representation or warning, much like how the target sentence introduces the world champion of taekwondo as a significant figure. Both sentences aim to convey the importance and impact of something through a visual or auditory representation."
256,"She knows he's lying to her, but she's choosing to turn a blind eye to the situation.","A. Walter failed his exam, but his father only responded, ""Son, don't cry over spilt milk,"" when he arrived.
B. Sally is not clueless about her situation with Scott, she has just decided to be with him despite the circumstances.
C. Mary wanted a big dog house for the dogs but Peter couldn't afford to build her one so she made one from the carboard boxes.
D. Sam decided not to engage with Peter in a friendly manner anymore after he made fun of her about her insecurities.",B,"B. Sally is not clueless about her situation with Scott, she has just decided to be with him despite the circumstances."
257,"Garry knows he is underpaid, but he chooses not to focus on it as he is more than happy to have a job.","A. How can you expect to not to fail if you didn't study for the test at all?.
B. Listen, losing weight is easier said than done, many people lack commitment.
C. The professor knows the students mostly copied the homework, but decides not to be strict about it.
D. Andy opened the window blinds to see the sun rising. The dark room was brighly lit in a few hours.",C,"C. The professor knows the students mostly copied the homework, but decides not to be strict about it.

Analogous sentence: D. The boss knows the employees are overworked and underpaid, but decides not to address it."
258,"Sally is not clueless about her situation with Scott, she has just decided to be with him despite the circumstances.","A. I've heard that the defense lawyer has a fresh eyewitness who was previously unknown.
B. He spoke about his guitar skills poorly, but when he played, his hard work showed through the music he produced.
C. Post graduation, Emily decided to not go for any jobs but instead chose to travel and paint for enjoyment.
D. The professor knows the students mostly copied the homework, but decides not to be strict about it.",D,"C. Post graduation, Emily decided to not go for any jobs but instead chose to travel and paint for enjoyment.

The most analogous sentence would be:
D. The artist knows that her paintings are mostly copied, but decides not to be strict about it."
259,"He knows Rick is not a good friend and is only after money, but chooses to get along with him for the time being.","A. John is rich and everyone is envious of his wealth. But he is also lonely as he has no one to share his life with.
B. The professor knows the students mostly copied the homework, but decides not to be strict about it.
C. Better to buy the sweets we are accustomed to than to try the new ones that might taste better.
D. Your friend going to the spa instead of doing her homework doesn't mean you can do it too.",B,"D. Your friend going to the spa instead of doing her homework doesn't mean you can do it too.

Analogous sentence:
She knows he is not a reliable partner and only wants a relationship for his own gain, but she chooses to continue seeing him for now.

Letter: D."
260,"The professor knows the students mostly copied the homework, but decides not to be strict about it.","A. She knows he's lying to her, but she's choosing to turn a blind eye to the situation.
B. I am afraid of walking on the streets at night but I will eventually do it one day once I start living alone.
C. Linda's demeanor changes whenever her husband is around. She feels she can be her true self whenever she's with him.
D. Be thankful for the sunshine this summer because it only appears briefly during the winter.",A,"A. [ ]

B. [ ]

C. [ ]

D. [ ]

Answer: [C]

Explanation:

The most analogous sentence is C, as it also involves a change in behavior or demeanor based on the presence or absence of someone else. However, in this case, Linda's change is a positive one, whereas the professor's decision not to be strict is a more ambiguous one. Nonetheless, both situations involve a shift in behavior based on external factors.

Note: The answer may vary based on the specific context and interpretation of the target sentence and options. In this case, the answer is based on the idea that the professor's decision not to be strict is a result of external factors (the students copying the homework) rather than an inherent change in his behavior or attitude towards the students. If the target sentence had instead stated that the professor decided not to be strict because he believed it was the right thing to do, then the answer would be different."
261,"Lisa knew that Mark borrowed her book without asking, but she doesn't mention this to him.","A. She worked for weeks on the project and got so exhausted that she decided to go on a vacation for a month.
B. The boy who cried wolf got his comeuppance once the wolves really came.
C. He knows Rick is not a good friend and is only after money, but chooses to get along with him for the time being.
D. He slipped at the edge of the cliff but managed to hold on to the rock and was saved just in time.",C,"The most analogous sentence would be:

C. He knows Rick is not a good friend and is only after money, but chooses to get along with him for the time being.

Analogous sentence: She knows that he is not a trustworthy person and is only interested in her wealth, but she decides to tolerate him for the present."
262,"She never bragged about her grades but secured the second position in the board exams. Truly, actions speak louder than words.","A. Peter's parents said they were not good parents at all but they were always ready to spend quality time with their children showing they were really good parents.
B. My daughter creates problems for my mom in the afternoon if she has nothing else to do. After all, an idle brain is the devil’s workshop.
C. I would have preferred a house of my own rather than sharing, but beggars can't be choosers, I suppose.
D. I think it’s better to compromise with your neighbour now instead of letting tensions simmer and allowing the problem to snowball.",A,"D. I think it’s better to compromise with your neighbour now instead of letting tensions simmer and allowing the problem to snowball.

Actions speak louder than words in this scenario as well. By compromising with the neighbour, the problem is being addressed and resolved, rather than letting it fester and potentially escalate into a bigger issue. Just as the speaker in the target sentence didn't need to boast about her academic achievements because her results spoke for themselves, compromising with a neighbour can be a more effective solution than letting tensions build."
263,"He never told her about his feelings but everytime he met her, he was caring towards her.","A. Even if rain is on the forecast, keep watering your garden.
B. Garry talked about how easily he managed the work stress. But his constant need of smoking told a different story.
C. Monica cooked so much food last weekend in the restaurant that she had to take a leave to rest on Monday.
D. Don't you know he is the president of the United States?!.",B,"B. Garry talked about how easily he managed the work stress. But his constant need of smoking told a different story.

Analogous sentence:
She always claimed to be a healthy person, but her frequent visits to the doctor told a different story."
264,She posted a lot about her friendship with Mary on Instagram. But in reality they hardly had any bond as they were constantly on their phones when together.,"A. Even though it took me two weeks, I at least sent the letter.
B. You can't drive a car with no fuel.
C. Larry was upset even months after breaking up with Samantha. So, Mary, his sister finally told him that there is no point in dwelling over it since Samantha has moved on.
D. He never told her about his feelings but everytime he met her, he was caring towards her.",D,"D is the most analogous sentence to the target sentence as it also involves someone's actions not matching their true feelings or intentions towards another person. However, in this case, it is the opposite of the target sentence, where the person's actions are more positive than their true feelings."
265,"He spoke about his guitar skills poorly, but when he played, his hard work showed through the music he produced.","A. He never told her about his feelings but everytime he met her, he was caring towards her.
B. Resolving small issues in relationships immediately may prevent bigger troubles down the road.
C. The professor knows the students mostly copied the homework, but decides not to be strict about it.
D. You wouldn't have these options once you move across the country, so work hard while you are here.",A,"The most analogous sentence would be:

D. He never showed off his guitar skills, but when he played, his hard work was evident in the music he produced.

Options:
A. She never expressed her love for him, but every time they met, she showed him affection.
B. Addressing minor problems in relationships promptly can prevent major conflicts in the future.
C. The teacher suspected cheating from the students, but chose to be lenient.
D. You won't have these opportunities once you move away, so make the most of it while you're here.

Letter: D"
266,Garry talked about how easily he managed the work stress. But his constant need of smoking told a different story.,"A. Peter's parents said they were not good parents at all but they were always ready to spend quality time with their children showing they were really good parents.
B. The parents have been living happily ever since they decided not to go through the divorce.
C. I have set my mind to go through the spreadsheets by Monday and I am working for it hook, line and sinker.
D. All the songs on her album are amazing, but the last one is the one that ruins the vibe.",A,"D is the most analogous sentence to the target sentence as it highlights a contrast between the first part of the sentence and the second part. However, in this case, the first part is positive while the second part is negative, whereas in the target sentence, the first part is positive but the second part reveals a different reality. In D, the first part is positive as all the songs on her album are amazing, but the second part ruins the vibe, indicating that the last song is not as good as the others. This contrast is similar to the target sentence where Garry talked about how easily he managed the work stress, but his constant need of smoking told a different story.

Letter: D."
267,Peter's parents said they were not good parents at all but they were always ready to spend quality time with their children showing they were really good parents.,"A. Every cigarette you smoked is a threat to your health.
B. A friend of mine who had failed 12th grade for the last five years, finally succeeded to pass.
C. Andy played hooky from work for a week saying he was sick, now he is on very thin ice according to his boss.
D. He never told her about his feelings but everytime he met her, he was caring towards her.",D,"D. He never told her about his feelings but everytime he met her, he was caring towards her.

Analogous sentence:
Although they argued constantly, he always made sure to be there for her in times of need, showing that he truly cared for her.

Letter: D."
268,A forest grew near the river.,"A. After seeing Tim being disappointed over not making the basketball team, Barry advised him to stray away from his emotions and work hard to try again next year.
B. Even if rain is on the forecast, keep watering your garden.
C. It is better to use a map with directions than reading the instructions on how to arrive at the event.
D. John brought out one dish after another onto the dining room table. Soon, all the guests began gathering around.",D,"D does not describe a forest growing near a river, so it is not the most analogous sentence.

A, B, and C all describe actions or decisions being made, but they do not involve the growth of a forest.

Therefore, the most analogous sentence would be:

C. A garden flourished beside the river."
269,Many students came to study under the guru.,"A. Sally had to gather the strength to be the pillar of support for her parents when her only sibling passed away.
B. He attacked every point in my argument.
C. The way the book is written, I get distracted by the peculiar grammar and word choice and can't learn anything from it.
D. Andy opened the window blinds to see the sun rising. The dark room was brighly lit in a few hours.",D,"D does not accurately represent the target sentence in terms of grammar and meaning.

A, B, and C are all different in meaning and structure from the target sentence.

The most analogous sentence would be:

Many students came to learn under the guidance of the guru.

So, the most analogous letter would be:

C does not accurately represent the target sentence in terms of grammar and meaning.

A, B, and D are all different in meaning and structure from the target sentence.

The most analogous letter would be:

A. Many students came to study under the tutelage of the guru.

Therefore, the letter that is most analogous to the target sentence is A."
270,"John brought out one dish after another onto the dining room table. Soon, all the guests began gathering around.","A. In this part of town, there are always guys trying to deceitfully pass off cheap watches as authentic Rolexes.
B. Andy opened the window blinds to see the sun rising. The dark room was brighly lit in a few hours.
C. All the people who had the same interests at the conference were socializing together.
D. When Juli's favorite tree had fallen over, her father created a painting of it and said there was nothing else they could do.",B,C.
271,Mary collected so many books over the years that she eventually had enough to make her own library.,"A. A large suburban community has developed outside the city center over the past few decades.
B. I wanted to go out for dinner but I had no money and had to eat the left-over rice from last night.
C. Let Mike share the incident with you as he is the one who went through it and will be able to give enough details.
D. He never told her about his feelings but everytime he met her, he was caring towards her.",A,"C. Let Mike share the incident with you as he is the one who went through it and will be able to give enough details.

Note: The sentence is analogous to the target sentence because it highlights how someone's accumulation of experiences or events over time has resulted in a significant outcome, just as Mary's collection of books led to her creating a library."
272,Andy opened the window blinds to see the sun rising. The dark room was brighly lit in a few hours.,"A. John brought out one dish after another onto the dining room table. Soon, all the guests began gathering around.
B. The job was finally his after the last interview that went well.
C. He slipped at the edge of the cliff but managed to hold on to the rock and was saved just in time.
D. Monica cooked so much food last weekend in the restaurant that she had to take a leave to rest on Monday.",A,"D. Monica cooked so much food last weekend in the restaurant that she had to take a leave to rest on Monday.

Analogous sentence:
The chef prepared an extravagant feast for the guests, illuminating the entire dining hall with the warmth of the food. The following day, the chef was exhausted and had to take a break to recover.

Letter: D."
273,A large suburban community has developed outside the city center over the past few decades.,"A. A forest grew near the river.
B. Having cried the entire night she greeted everyone in the morning like sunshine.
C. The incharge was overjoyed to see that the floor had finally been cleaned properly by the new hire and was no longer slippery.
D. After losing half of the soldiers, they had no other option but to use the tank to fight.",A,"A. A new residential area has emerged on the outskirts of the city over the past few decades.

[A] is the most analogous sentence to the target sentence as it describes the development of a large suburban community outside the city center over a period of time. [B] and [C] are not analogous as they do not describe the development of a community or area. [D] is not analogous as it describes a military situation rather than the development of a community."
