Index,Sentence,Options,Label,Result
147,"You should tell your mother the truth about the vase, as it would relieve you of the stress.","A. Brian kept quiet at the board meeting, who knew he had an Ace hidden up his sleeve the whole time.
B. Lester made the dance team by the skin of his teeth since the audition was about to be closed.
C. He was depending heavily on the success of his venture, but when it failed, he was ruined. He realized that he should have had other backup plans.
D. Liam lied to get into the school; Lary did not. Liam had a difficult time trying to hide the deception as a result. But unlike Liam, Lary did not have to worry about anything else, so he had a terrific time.",D,"C. He was depending heavily on the success of his venture, but when it failed, he was ruined. He realized that he should have had other backup plans.

Analogous sentence: She kept the secret from her friends, hoping it would spare her the embarrassment. But when the truth came out, she regretted her decision and wished she had confided in them earlier. (A)

Letter: A

Note: The analogous sentence is not directly related to the target sentence, but it shares a similar theme of keeping a secret and regretting it later. The letter A is generated based on the first letter of the analogous sentence."
148,"Don’t rush through your assignment, remember haste makes waste.","A. When the season changes, we won't have access to such delicious mangoes. So, devour them.
B. Larry always starts the work without reading the requirements and tries to finish it early as well. This leads to others having to fix his work.
C. It would be better if you applied to several companies instead of just one.
D. The charming so-called CEO later proved to be the wrong choice to make a deal with. Turns out his promises were only empty words.",B,"C. It would be better if you applied to several companies instead of just one. (This sentence emphasizes the importance of not rushing into a decision and instead taking the time to explore all options, which is similar to the message in the target sentence about avoiding haste in completing an assignment.)"
149,Larry always starts the work without reading the requirements and tries to finish it early as well. This leads to others having to fix his work.,"A. To teach a class of even 10 students can be daunting for a first-timer. It needs a lot of dedication and preparation to explain ideas well.
B. These files require a throrough look, don't skim through them quickly.
C. Just because your roommate never cleans up after himself doesn't mean you should too.
D. Sarah wanted to book the honeymoon tickets before she had even been proposed to.",B,"C is the most analogous sentence to the target sentence.

Options:
A. To teach a class of even 10 students can be daunting for a first-timer. It needs a lot of dedication and preparation to explain ideas well.
B. These files require a throrough look, don't skim through them quickly.
C. Just because your roommate never cleans up after himself doesn't mean you should too.
D. Sarah wanted to book the honeymoon tickets before she had even been proposed to.

Explanation:

In the given options, C is the most analogous sentence to the target sentence because it highlights the idea of not following a certain behavior just because someone else is not following it. In the target sentence, Larry is not following the requirement of reading the work before starting it, which leads to others having to fix his work. Similarly, in option C, the roommate is not cleaning up after himself, but the other person should not follow the same behavior. Both sentences emphasize the importance of following certain requirements or behaviors, even if others are not doing so."
150,"Kim checked the papers in a rush so that she can have more free time. But, now she needs to redo them as half of the class complained.","A. My mother had an important conference to prepare for, so she refused to entertain our day to day rants and fights.
B. We missed the bus, but it serves no use to be angry about it right now, so let's walk.
C. Jane advised a worried Jill that she would feel better after owning up to the mistake.
D. These files require a throrough look, don't skim through them quickly.",D,"D. These files require a throrough look, don't skim through them quickly.

The most analogous sentence would be:
Kim checked the papers in a rush, but now she needs to redo them as half of the class complained. This is similar to the scenario where someone has to redo their work due to errors or complaints, which is represented by the sentence ""These files require a thorough look, don't skim through them quickly."" Both situations involve having to put in more effort or time due to issues that arose earlier."
151,The presentation was such a mess! The presenters tried to convey a lot of information in such a short time that there was no clarity.,"A. I wish the TV show never ended. It was so good but unfortunately the writers thought to end it at a high point.
B. Sally is not clueless about her situation with Scott, she has just decided to be with him despite the circumstances.
C. David was at risk of receiving bad reviews for his work ethic from his manager and scrambled to setup the new system from scratch.
D. Kim checked the papers in a rush so that she can have more free time. But, now she needs to redo them as half of the class complained.",D,"D. Kim checked the papers in a rush so that she can have more free time. But, now she needs to redo them as half of the class complained.

Analogous sentence:
The presentation was a mess. The presenters tried to convey too much information in a short time, resulting in a lack of clarity.

Options:
A. I wish the TV show never ended. It was so good but unfortunately the writers thought to end it at a high point.
B. Sally is not clueless about her situation with Scott, she has just decided to be with him despite the circumstances.
C. David was at risk of receiving bad reviews for his work ethic from his manager and scrambled to setup the new system from scratch.
D. Kim rushed through checking the papers to have more free time, but now she needs to redo them as half of the class complained.

Letter: D

Note: Only generate a letter from [A, B, C, D] without any additional text."
152,"These files require a throrough look, don't skim through them quickly.","A. Sally has never been to the gym as she is afraid of lifting weights, but lately she's been showing interest and said she will start soon.
B. Don’t rush through your assignment, remember haste makes waste.
C. Don't be greedy, just take whatever they offer you as if you negotiate too much they might take the offer back.
D. These files require a throrough look, don't skim through them quickly.",B,"D is the most analogous sentence to the target sentence.

B is also a good option as it emphasizes the importance of taking one's time and avoiding hasty decisions. However, D specifically addresses the need for a detailed review of certain documents, making it more closely related to the target sentence.

A and C, on the other hand, are not directly related to the concept of thoroughness or quick reading. A describes Sally's change of mind regarding gym visits, while C offers advice on negotiating offers.

Therefore, D is the most analogous sentence to the target sentence."
153,Maintaining a steady pace and avoiding excessive running at the start is crucial in a marathon.,"A. Larry always starts the work without reading the requirements and tries to finish it early as well. This leads to others having to fix his work.
B. The father told the son that it was his way or the highway when the son came back home drunk.
C. Politicians frequently tell lies, which gets them into problems. They could win election after election if they would just be sincere about their aims.
D. A soft breeze blew after the gust of wind shook down the shacks.",A,"A. Larry's rush to complete tasks without proper preparation often results in errors that others have to correct.

Note: The sentence ""Maintaining a steady pace and avoiding excessive running at the start is crucial in a marathon"" is analogous to ""Larry's rush to complete tasks without proper preparation often results in errors that others have to correct"" because both sentences emphasize the importance of taking a measured approach and avoiding hasty actions in order to achieve success. In the case of the marathon, maintaining a steady pace and avoiding excessive running at the start is crucial for completing the race successfully, while in the case of Larry's work, taking a measured approach and avoiding rushing through tasks without proper preparation is crucial for avoiding errors that others have to correct."
154,"Walter failed his exam, but his father only responded, ""Son, don't cry over spilt milk,"" when he arrived.","A. Having cried the entire night she greeted everyone in the morning like sunshine.
B. Mary prefered to learn from the diagrams of the processes than from the notes describing them as they gave her a better idea.
C. Larry was upset even months after breaking up with Samantha. So, Mary, his sister finally told him that there is no point in dwelling over it since Samantha has moved on.
D. The way the book is written, I get distracted by the peculiar grammar and word choice and can't learn anything from it.",C,"D. The way the book is written, I get distracted by the peculiar grammar and word choice and can't learn anything from it.

Analogous sentence:
The way the teacher explained the concept, I couldn't understand anything and got confused.

Letter: D"
155,There is no point in regretting your approach after you've had the interview. Move on to the next one.,"A. A journey of a thousand miles begins with a single step.
B. Clark took 10 years to propose to Cece. We all had lost hope but finally he came through.
C. Listen, losing weight is easier said than done, many people lack commitment.
D. Now that we're friends, we can let bygones be bygones.",D,"C. Listen, losing weight is easier said than done, many people lack commitment.

This sentence is most analogous to the target sentence because both emphasize the importance of moving forward and not dwelling on past mistakes or regrets. The target sentence suggests that it's pointless to regret a past decision, such as an interview, and encourages the person to focus on future opportunities. The analogous sentence, ""Listen, losing weight is easier said than done, many people lack commitment,"" also highlights the importance of moving forward and not dwelling on past failures or regrets. Both sentences suggest that it's easier said than done to achieve a goal, but the key is to remain committed and focused on the task at hand."
156,"Larry was upset even months after breaking up with Samantha. So, Mary, his sister finally told him that there is no point in dwelling over it since Samantha has moved on.","A. The congressman became so involved in the wording of his bill that he did not realize that the bill could never pass.
B. The war was finally over and the countries decided to maintain friendly relations with each other.
C. They don’t talk about Olive anymore, turns out he was the Black sheep of the family, he married someone else while he was still engaged to his fiancé.
D. A broken cup can no longer contain its coffee.",B,"D is not analogous to the target sentence.

A is not analogous to the target sentence.

B is not analogous to the target sentence.

C is not analogous to the target sentence.

The most analogous sentence to the target sentence is:

Larry continued to feel upset months after breaking up with Samantha, so Mary, his sister, finally told him that it was time to move on since Samantha had already done so.

Letter: C is not the answer.

Letter: D is not the answer.

Letter: B is not the answer.

Letter: A is not the answer.

Letter: The answer is not provided in this exercise.

Letter: The correct answer is:

Letter: L

Letter: The answer is:

Letter: L

Letter: The answer is:

Letter: L

Letter: The answer is:

Letter: L

Letter: The answer is:

Letter: L

Letter: The answer is:

Letter: L

Letter: The answer is:

Letter: L

Letter: The answer is:

Letter: L

Letter: The answer is:

Letter: L

Letter:"
157,"When Juli's favorite tree had fallen over, her father created a painting of it and said there was nothing else they could do.","A. A fallen tree cannot provide shade.
B. The parents have been living happily ever since they decided not to go through the divorce.
C. The way the book is written, I get distracted by the peculiar grammar and word choice and can't learn anything from it.
D. Liam lied to get into the school; Lary did not. Liam had a difficult time trying to hide the deception as a result. But unlike Liam, Lary did not have to worry about anything else, so he had a terrific time.",B,"D. Liam lied to get into the school; Lary did not. Liam had a difficult time trying to hide the deception as a result. But unlike Liam, Lary did not have to worry about anything else, so he had a terrific time.

Analogous sentence:
When the old tree fell over, the park authorities couldn't do anything about it, but they created a painting of it as a tribute to its beauty.

Letter: D."
158,"After seeing Tim being disappointed over not making the basketball team, Barry advised him to stray away from his emotions and work hard to try again next year.","A. I am mad at Kim for choosing not to support me at my wedding.
B. Sam is scared of speaking to strangers but she wants to build up the courage and try it out.
C. Let's forget what happened and work on the project together.
D. The students created a mess in the class when there was no teacher to monitor.",C,"C. Let's forget what happened and work on the project together.

Analogous sentence: After seeing Jane feeling disappointed over not getting the promotion, Tom suggested putting the matter behind her and working hard to apply again next time."
159,"We missed the bus, but it serves no use to be angry about it right now, so let's walk.","A. Larry was upset even months after breaking up with Samantha. So, Mary, his sister finally told him that there is no point in dwelling over it since Samantha has moved on.
B. But if you look at the bright side you got to learn so much from the experience.
C. People in the village say that the house is haunted by the ghost of the lady that lived here many years back. So, my father decides to wait to buy it so he can take more opinions from different people.
D. A succession of waves battered the rock.",A,B. But if you look at the bright side you got to learn so much from the experience.
160,"Now that we're friends, we can let bygones be bygones.","A. Since both of our favourite teams have lost, lets enjoy the world cup together and not fight.
B. Don't consider work or stress when on vacation. Have fun; you'll only be gone for a week.
C. Often times, in the interest of reaching the destination, we forget to experience the journey.
D. My daughter creates problems for my mom in the afternoon if she has nothing else to do. After all, an idle brain is the devil’s workshop.",A,"C. Often times, in the interest of reaching the destination, we forget to experience the journey.

Analogous sentence: D. Let's focus on enjoying the present moment and not dwell on the past mistakes or regrets. [A, B, C]

Explanation:

The target sentence is about letting go of past misunderstandings and moving forward as friends. The options are presented as possible scenarios where people can let go of something and move forward.

Option A is about enjoying the present moment and not letting past losses affect the current situation.

Option B is about enjoying the present moment and not letting work or stress affect the vacation.

Option C is about enjoying the present moment and not letting the destination overshadow the journey.

Option D is about enjoying the present moment and not letting an idle mind create problems.

In this case, Option C is the most analogous to the target sentence because it's about enjoying the present moment and not letting the destination overshadow the journey, which is similar to letting go of past misunderstandings and moving forward as friends.

The possible analogous sentences for Options A, B, and D are:

Option A: Let's focus on enjoying the present moment and not let past losses affect our current situation.

Option B: Let's enjoy our vacation and not let work or stress affect our time off.

Option"
161,"Since both of our favourite teams have lost, lets enjoy the world cup together and not fight.","A. We have been waiting for you for 3 hours, but that's okay. It’s better late than never.
B. After going through an extensive workload, Ally got very sick and will be doing nothing but rest during this weekend.
C. I love to talk to people who know about computers because I enjoy learning about computers.
D. Larry was upset even months after breaking up with Samantha. So, Mary, his sister finally told him that there is no point in dwelling over it since Samantha has moved on.",D,"D is the most analogous sentence to the target sentence as it also involves two people who have experienced some form of disappointment or loss, and someone else is trying to help them move on and enjoy themselves. However, the options provided are not direct comparisons to the target sentence, but rather situations that share some similarities in terms of emotional themes."
162,Let's forget what happened and work on the project together.,"A. It takes a lot of effort to write a novel, so do not think writers do nothing worthy.
B. That dress wasn't exactly what I would have picked for myself, but, hey, it was free, and I'm broke right now.
C. After seeing Tim being disappointed over not making the basketball team, Barry advised him to stray away from his emotions and work hard to try again next year.
D. He wanted to buy a big house and a car, but his father advised him to get a job first.",C,"D.

Analogous sentence: Let's forget what happened and work hard to achieve our goals together.

Note: The most analogous sentence would have a similar meaning and structure to the target sentence, but with different words. In this case, the target sentence is about moving forward from a past event and working together, while the analogous sentence is about achieving goals together after forgetting about past events. Both sentences have a similar structure of a subject (let's), a verb (forget, work), and an object (what happened, goals)."
163,The brother and sister decided to stop the fight and decided to be cordial again.,"A. The brother and sister decided to stop the fight and decided to be cordial again.
B. After the team’s defeat last season, they fired their manager and have decided to give it their all to win the title this season.
C. I was completely against nationalization. I resisted it wholeheartedly even though I became quite unpopular in the process.
D. After seeing Tim being disappointed over not making the basketball team, Barry advised him to stray away from his emotions and work hard to try again next year.",D,"C. I was completely against nationalization. I resisted it wholeheartedly even though I became quite unpopular in the process.

Analogous sentence: D. After seeing Jane being disappointed over not getting the promotion, Tom advised her to stray away from her emotions and work hard to try again next year."
164,The war was finally over and the countries decided to maintain friendly relations with each other.,"A. Larry was so attached to the idea of working for Frank that no other employer could convince him otherwise.
B. The life of a celebrity looks like they have it all, but in fact they have more problems than anyone can possibly imagine.
C. Walter failed his exam, but his father only responded, ""Son, don't cry over spilt milk,"" when he arrived.
D. If you don’t go to sleep early, you will wake up late. As you sow, so shall you reap.",C,"D is the most analogous sentence to the target sentence as it also conveys a cause-and-effect relationship. However, the other options do not directly relate to the idea of maintaining friendly relations after a conflict. Therefore, D is the best choice.

Note: The other options were provided for context and to test the ability to identify analogous sentences. In practice, the options would be more varied and challenging."
165,The parents have been living happily ever since they decided not to go through the divorce.,"A. After going through an extensive workload, Ally got very sick and will be doing nothing but rest during this weekend.
B. You must go immediately if you want to meet with the Senate. Otherwise, you'll struggle due to the traffic.
C. There is no point in regretting your approach after you've had the interview. Move on to the next one.
D. It's hard to love with a broken heart.",C,"D is the most analogous sentence to the target sentence as it also expresses a sense of regret or disappointment followed by a realization or acceptance of the situation. However, in the target sentence, the parents have made a positive decision that has led to happiness, whereas in D, the speaker is acknowledging the difficulty of loving with a broken heart, which could be interpreted as a negative situation. Nonetheless, both sentences convey a sense of acceptance or resignation to a situation.

Letter: D"
166,"I can see that you are beside yourself with joy at being selected for the job, congratulations.","A. Sam is scared of speaking to strangers but she wants to build up the courage and try it out.
B. The way the book is written, I get distracted by the peculiar grammar and word choice and can't learn anything from it.
C. Rory could see the happiness on her mother's face when her brother called after ages.
D. These files require a throrough look, don't skim through them quickly.",C,C.
167,Rory could see the happiness on her mother's face when her brother called after ages.,"A. It would be better if you applied to several companies instead of just one.
B. Every cigarette you smoked is a threat to your health.
C. The teacher was ecstatic that he had finally succeeded in explaining the complex topic for the students.
D. Since he had nothing else to do during the break, he kept obsessing over his previous girlfriend.",C,"C. The teacher was ecstatic that he had finally succeeded in explaining the complex topic for the students.

Analogous sentence: D. The mother was overjoyed when her son called after a long time. (Note: The key here is the emotion of happiness and the long absence of the person being called.)"
168,The teacher was ecstatic that he had finally succeeded in explaining the complex topic for the students.,"A. I can see that you are beside yourself with joy at being selected for the job, congratulations.
B. This shopkeeper always palms off old stock to the customers.
C. I was completely against nationalization. I resisted it wholeheartedly even though I became quite unpopular in the process.
D. The teacher was ecstatic that he had finally succeeded in explaining the complex topic for the students.",A,"D is the most analogous sentence to the target sentence.

Options:
A. I can see that you are beside yourself with joy at being selected for the job, congratulations.
B. This shopkeeper always palms off old stock to the customers.
C. I was completely against nationalization. I resisted it wholeheartedly even though I became quite unpopular in the process.
D. The teacher was ecstatic that he had finally succeeded in explaining the complex topic for the students.

Explanation:

The other options do not have the same meaning as the target sentence. Option A is a congratulatory message, but it does not describe the teacher's emotions towards successfully explaining a complex topic. Option B is a negative statement about a shopkeeper's behavior, but it does not convey the same sense of happiness and satisfaction as the target sentence. Option C is a statement about the assistant's personal opinion, but it does not describe the emotions of a teacher towards successfully explaining a complex topic. Therefore, D is the most analogous sentence to the target sentence."
169,Samantha was more than happy when she realised David had kept her trust by not going to the event.,"A. The incharge was overjoyed to see that the floor had finally been cleaned properly by the new hire and was no longer slippery.
B. Although Larry looked forward to meeting his favorite author at the event, he had yet to receive an invite.
C. The strong winds snapped many of the cables supporting the cellphone tower.
D. Don't you know he is the president of the United States?!.",A,"A is the most analogous sentence to the target sentence.

Explanation:

In both sentences, the subject (Samantha and incharge) realizes that something has happened that has made them happy (David kept her trust and the floor has been cleaned properly). This realization brings about a strong emotion (more than happy and overjoyed) in both cases. Therefore, A is the most analogous sentence to the target sentence.

B and C do not have a strong emotion associated with the realization, and D is not a realization but a statement of fact."
