Index,Sentence,Options,Label,Result
75,"The painter did not have the yellow color with him so had to paint with red, making his painting famous for its unconventional choice.","A. It would have been okay if you had discussed the problem right then and there. Now, it's too late and a lot of work is required to rectify this.
B. John is rich and everyone is envious of his wealth. But he is also lonely as he has no one to share his life with.
C. As they say, every cloud has a silver lining. If we hadn't missed the plane, we would never have met you.
D. The process of quiting smoking starts with a desire to quit smoking.",C,"C. As they say, every cloud has a silver lining. If we hadn't missed the plane, we would not have met you, making our missed flight famous for its unconventional outcome.

Note: The analogous sentence is formed by replacing the key elements of the target sentence with their equivalents in the most similar sentence from the options. Here, the key elements are ""unconventional choice"" and ""famous"", which are replaced by ""unconventional outcome"" and ""famous"" respectively. The sentence structure is also maintained.

However, the analogous sentence is not a valid sentence as it does not make sense in the given context. It is provided as an example of how to form an analogous sentence.

The correct answer is C. As they say, every cloud has a silver lining. If we hadn't missed the plane, we would not have met you."
76,A journey of a thousand miles begins with a single step.,"A. Rory could see the happiness on her mother's face when her brother called after ages.
B. The chef picks out a dish from his list of simpler recipies for the less adventurous customer.
C. After years of working as a lawyer, Smith decided to quit and open a youtube channel for his singing videos.
D. As someone with social anxiety, joining the debate club many years ago led me to become a powerful and persuasive public speaker.",D,"D. As someone with social anxiety, joining the debate club many years ago led me to become a powerful and persuasive public speaker.

Analogous sentence: C. After years of working as a lawyer, Smith decided to quit and pursue his passion for painting full-time.

Explanation:

The target sentence ""A journey of a thousand miles begins with a single step"" highlights the idea that achieving a significant goal requires taking the first step. The sentence ""As someone with social anxiety, joining the debate club many years ago led me to become a powerful and persuasive public speaker"" also emphasizes the importance of taking the first step towards achieving a goal, in this case, overcoming social anxiety and becoming a confident speaker. The sentence ""C. After years of working as a lawyer, Smith decided to quit and pursue his passion for painting full-time"" is analogous because it highlights the idea that achieving a significant goal, in this case, pursuing a career in painting, requires taking the first step, which in this case is quitting a stable career as a lawyer."
77,We all begin our lives as a baby and slowly learn and grow.,"A. Her atheltic career started with her first visit to the gym. She never looked back and now is a world class athelete.
B. Listen, losing weight is easier said than done, many people lack commitment.
C. People in the village say that the house is haunted by the ghost of the lady that lived here many years back. So, my father decides to wait to buy it so he can take more opinions from different people.
D. The father told the son that it was his way or the highway when the son came back home drunk.",A,"B. Her atheltic career started with her first visit to the gym. She never looked back and now is a world class athelete.

A: Her atheltic career began with her first trip to the gym. She never looked back and now is a top-tier athlete.

B: Losing weight is easier said than done. Many people lack commitment.

C: People in the village say that the house is haunted by the ghost of the lady who used to live here many years ago. My father is waiting to buy it so he can get more opinions from different people.

D: The father told the son that it was his way or the highway when the son came back home drunk.

The most analogous sentence to the target sentence would be:

C: People say that learning and growing starts from birth. I too began my life as a baby and have been learning and growing ever since.

A: Her educational journey started with her first day of school. She never looked back and now has a Ph.D.

B: Learning a new language is easier said than done. Many people lack the time and resources.

D: The teacher told the student that it was his way or the highway when he failed to complete his assignments.

In this case, the most analogous sentence would be:

C: People say that learning and growing starts from"
78,"By writing simple code first, one can eventually master the art of coding complex algorithms.","A. Your 20s are the best time of your life, enjoy it while it lasts.
B. Many people fail to understand the beauty of mathematics. But to me, it is the most meaningful subject.
C. As someone with social anxiety, joining the debate club many years ago led me to become a powerful and persuasive public speaker.
D. I wish the TV show never ended. It was so good but unfortunately the writers thought to end it at a high point.",C,"C is the most analogous sentence to the target sentence as it highlights the idea of starting with simplicity and gradually building up to mastery. In C, the person starts with social anxiety and overcomes it through joining the debate club, eventually becoming a powerful and persuasive public speaker. Similarly, in the target sentence, starting with simple coding and eventually mastering complex algorithms is emphasized.

[C]"
79,Her atheltic career started with her first visit to the gym. She never looked back and now is a world class athelete.,"A. While people believed it was impossible to escape from the secret police, Peter somehow managed to do so successfully, albeit a bit close for comfort.
B. A journey of a thousand miles begins with a single step.
C. Although I'm pretty familiar with this part of the woods and don't need a map, I still brought one with me in case I got lost during the hike.
D. Frank finally had a good sleep in his childhood bed when he returned to the familiarity of his home country after years of working in faraway lands.",B,"D. Frank finally had a good sleep in his childhood bed when he returned to the familiarity of his home country after years of working in faraway lands.

Analogous sentence: Her atheltic career started with her first visit to the gym in her home country after years of training in faraway lands. She never looked back and now is a world class athelete.

Letter: D."
80,The process of quiting smoking starts with a desire to quit smoking.,"A. Her atheltic career started with her first visit to the gym. She never looked back and now is a world class athelete.
B. He was depending heavily on the success of his venture, but when it failed, he was ruined. He realized that he should have had other backup plans.
C. A large suburban community has developed outside the city center over the past few decades.
D. By that time, my friend was broke, so he had to sell his house.",A,"C is not analogous to the target sentence.

A. Her atheltic career started with her first visit to the gym. She never looked back and now is a world class athelete.

B. He was depending heavily on the success of his venture, but when it failed, he was ruined. He realized that he should have had other backup plans.

D. By that time, my friend was broke, so he had to sell his house.

The most analogous sentence to the target sentence is:

B. He was depending heavily on the success of his venture, but when it failed, he was ruined. He realized that he should have had other backup plans.

The process of quitting smoking starts with a desire to quit smoking.

In this case, the process of quitting smoking is analogous to the process of having backup plans. Both involve recognizing a need for change and taking action to address it. In the target sentence, the need is to quit smoking, and in the analogous sentence, the need is to have backup plans in case a venture fails. Both sentences describe a starting point for addressing a need or issue."
81,"As someone with social anxiety, joining the debate club many years ago led me to become a powerful and persuasive public speaker.","A. Her atheltic career started with her first visit to the gym. She never looked back and now is a world class athelete.
B. If the workers cannot work for 20 hours a week, they can quit.
C. That dress wasn't exactly what I would have picked for myself, but, hey, it was free, and I'm broke right now.
D. Everyone likes me because I'm so quiet and obedient. The same cannot be said for my wild cousin Nathan, who always lands himself in trouble.",A,"D does not accurately represent the target sentence's sentiment. The other options are:

A. Her atheletic career started with her first visit to the gym. She never looked back and now is a world class athelete.

B. If the workers cannot work for 20 hours a week, they can quit.

C. That dress wasn't exactly what I would have picked for myself, but, hey, it was free, and I'm broke right now.

The most analogous sentence to the target sentence is:

A. Her atheletic career started with her first visit to the gym. She never looked back and now is a world class athelete.

Explanation:

Both sentences describe a transformation or improvement in a person's ability or situation. In the target sentence, the person with social anxiety becomes a powerful and persuasive public speaker as a result of joining the debate club. In the analogous sentence, the person becomes a world class athlete as a result of starting their athletic career. Both sentences illustrate how taking a particular action or making a decision can lead to significant positive changes in a person's life."
82,People work their hardest to attain something only when it is necessary for them.,"A. A large suburban community has developed outside the city center over the past few decades.
B. As someone with social anxiety, joining the debate club many years ago led me to become a powerful and persuasive public speaker.
C. Better to buy the sweets we are accustomed to than to try the new ones that might taste better.
D. Normally I try to maintain a good work-life balance, but I worked all of last week non stop because I had 5 deadlines and I couldn't miss any of them.",D,"D is the most analogous sentence to the target sentence as it also highlights the idea that people put in their maximum effort or work hardest when there is a necessity or urgency involved. In D, the person is working non-stop for 5 deadlines and couldn't miss any of them, indicating that they are working their hardest due to the necessity of meeting the deadlines."
83,If my project partner hadn't gotten sick I never would have need to finish the entire assignment on my own by working day and night.,"A. To avoid burning your hands, use oven mitts when removing the cake, as it will be hot unlike how it is now.
B. Don’t lie to land a job, remember that honesty is the best policy.
C. Normally I try to maintain a good work-life balance, but I worked all of last week non stop because I had 5 deadlines and I couldn't miss any of them.
D. The painter did not have the yellow color with him so had to paint with red, making his painting famous for its unconventional choice.",C,"C. Normally I try to maintain a good work-life balance, but I worked all of last week non stop because I had 5 deadlines and I couldn't miss any of them.

Analogous sentence:
If my project partner hadn't gotten sick, I could have maintained a good work-life balance and not had to finish the entire assignment on my own by working day and night to meet the deadlines.

Letter: C."
84,"Normally I try to maintain a good work-life balance, but I worked all of last week non stop because I had 5 deadlines and I couldn't miss any of them.","A. David was at risk of receiving bad reviews for his work ethic from his manager and scrambled to setup the new system from scratch.
B. He never told her about his feelings but everytime he met her, he was caring towards her.
C. People in the village say that the house is haunted by the ghost of the lady that lived here many years back. So, my father decides to wait to buy it so he can take more opinions from different people.
D. The group managed to finish the project just in time and submitted the report two minutes before the deadline.",A,D.
85,Sally had to gather the strength to be the pillar of support for her parents when her only sibling passed away.,"A. Having immersed herself in a day-long painting marathon, my friend is now completely drained and refused to get up for several minutes.
B. David was at risk of receiving bad reviews for his work ethic from his manager and scrambled to setup the new system from scratch.
C. The music producer selects a less liked song from his collection for his least favorite client.
D. Soon after, Garry realized that Hannah was avoiding making the presentation by pretending to be occupied by personal issues, he planned to approach her about it if she repeated it again.",B,"D does not seem to be a good match for the target sentence. The other options are:

A. Sally had to gather the strength to be the pillar of support for her parents when her only sibling passed away.

B. Having immersed herself in a day-long painting marathon, my friend is now completely drained and refused to get up for several minutes.

C. The music producer selects a less liked song from his collection for his least favorite client.

The most analogous sentence to the target sentence would be:

B. David was at risk of receiving bad reviews for his work ethic from his manager and scrambled to setup the new system from scratch.

In this sentence, David had to gather the strength to handle a difficult situation at work and take action to rectify it. This is similar to Sally's situation where she had to be a pillar of support for her parents during a difficult time."
86,David was at risk of receiving bad reviews for his work ethic from his manager and scrambled to setup the new system from scratch.,"A. Resolving small issues in relationships immediately may prevent bigger troubles down the road.
B. After letting off his rage he sat down like a lamb.
C. If my project partner hadn't gotten sick I never would have need to finish the entire assignment on my own by working day and night.
D. Larry was so attached to the idea of working for Frank that no other employer could convince him otherwise.",C,"The most analogous sentence would be:

C. Larry was so attached to the idea of completing the project on his own that no other solution could convince him otherwise, as he scrambled to setup the new system from scratch after facing the risk of receiving bad reviews for his work ethic from his manager.

Options:
A. Resolving small issues in relationships immediately may prevent bigger troubles down the road.
B. After letting off his rage he sat down like a lamb.
C. If my project partner hadn't gotten sick I never would have need to finish the entire assignment on my own by working day and night.
D. Larry was so attached to the idea of working for Frank that no other employer could convince him otherwise.

Explanation:

The sentence ""Larry was so attached to the idea of completing the project on his own that no other solution could convince him otherwise, as he scrambled to setup the new system from scratch after facing the risk of receiving bad reviews for his work ethic from his manager"" is analogous to the target sentence ""David was at risk of receiving bad reviews for his work ethic from his manager and scrambled to setup the new system from scratch"" because both sentences describe a situation where an individual is facing criticism or negative feedback for their work and is taking immediate action to address the issue, in this case, setting up a new system from scratch. The sentence ""L"
87,"Megan, a lousy student, worked twice as hard and revised her basics once she was told to mentor two new members of the team.","A. Normally I try to maintain a good work-life balance, but I worked all of last week non stop because I had 5 deadlines and I couldn't miss any of them.
B. John studied all throughout college in the hopes of landing a good job. He made sacrifices and put in a lot of hard work.
C. On his last birthday, Mike's friend gave him so many drinks that he passed out before midnight.
D. Do you know who you're facing? That's the world champion of taekwondo standing right there!.",A,"B. John studied all throughout college in the hopes of landing a good job. He made sacrifices and put in a lot of hard work.

Analogous sentence: Megan, who struggled as a student, doubled her efforts and reviewed her fundamentals after being assigned to mentor two new team members.

Letter: B."
88,It is not acceptable to do a bad thing just because someone else has done it.,"A. The presentation was such a mess! The presenters tried to convey a lot of information in such a short time that there was no clarity.
B. Your friend going to the spa instead of doing her homework doesn't mean you can do it too.
C. Frank has never tried to write a computer program before as he finds computers daunting. But last time we met, he said he will go for it.
D. After going through an extensive workload, Ally got very sick and will be doing nothing but rest during this weekend.",B,"B. Your friend going to the spa instead of doing her homework doesn't mean you can do it too.

Analogous sentence: C. Frank has never tried to write a computer program before as he finds computers daunting. But last time we met, he said he will go for it.

Explanation: Both sentences involve situations where individuals have not previously engaged in a particular activity but are considering doing so in the future. The target sentence emphasizes the importance of not following a negative example, while the analogous sentence highlights the decision-making process of individuals who have not previously participated in a particular activity. Both sentences convey the idea that personal choices should not be based solely on the actions of others."
89,"You should not be using your pen for gossip and rumors, even though other media reporters are doing so.","A. But if you look at the bright side you got to learn so much from the experience.
B. Sally spent the weekend relaxing following her sister's example. But it was not right choice as she had a lot of work to do.
C. Keep a jug full of water near the table in case you get thirsty at night.
D. Her ideas were challenged as she read book after book.",B,"D is not analogous to the target sentence.

A. But if you look at the bright side you got to learn so much from the experience.

This sentence is not analogous to the target sentence as it does not address the topic of gossip or rumors.

B. Sally spent the weekend relaxing following her sister's example. But it was not right choice as she had a lot of work to do.

This sentence is not analogous to the target sentence as it does not address the topic of media reporting or gossip.

C. Keep a jug full of water near the table in case you get thirsty at night.

This sentence is not analogous to the target sentence as it does not address the topic of media reporting or gossip.

D. Her ideas were challenged as she read book after book.

This sentence is not analogous to the target sentence as it does not address the topic of media reporting or gossip.

Therefore, none of the options provided are analogous to the target sentence."
90,Just because your roommate never cleans up after himself doesn't mean you should too.,"A. Lets meet him and ask about the robbery. Since he is the one who was robbed, it would be much more thrilling to hear.
B. Your friend going to the spa instead of doing her homework doesn't mean you can do it too.
C. Frank has never tried to write a computer program before as he finds computers daunting. But last time we met, he said he will go for it.
D. Although Larry looked forward to meeting his favorite author at the event, he had yet to receive an invite.",B,"B. Your friend going to the spa instead of doing her homework doesn't mean you can do it too.

Analogous letter: C. Frank has never tried to write a computer program before as he finds computers daunting. But last time we met, he said he will go for it.

Explanation: Both sentences involve situations where someone has not done a particular task or activity, but that does not mean that others should also not do it. In the target sentence, the roommate does not clean up after himself, but that does not mean the speaker should not clean up either. In the analogous sentence, Frank has not tried writing a computer program because he finds computers daunting, but that does not mean others should not try it either. Both sentences convey the idea that just because someone has not done something does not mean others should not do it as well."
91,Your friend going to the spa instead of doing her homework doesn't mean you can do it too.,"A. Larry always starts the work without reading the requirements and tries to finish it early as well. This leads to others having to fix his work.
B. Sally spent the weekend relaxing following her sister's example. But it was not right choice as she had a lot of work to do.
C. I don’t really like the colour of your car, but then, beauty lies in the eyes of the beholder.
D. That dress wasn't exactly what I would have picked for myself, but, hey, it was free, and I'm broke right now.",B,B. Sally spent the weekend relaxing following her sister's example. But it was not right choice as she had a lot of work to do.
92,Sally spent the weekend relaxing following her sister's example. But it was not right choice as she had a lot of work to do.,"A. Politicians frequently tell lies, which gets them into problems. They could win election after election if they would just be sincere about their aims.
B. David was at risk of receiving bad reviews for his work ethic from his manager and scrambled to setup the new system from scratch.
C. When the site was just discovered and undeveloped, Larry was able to purchase the home for a low price. Now, the price has risen to the point where even Will cannot afford it.
D. Your friend going to the spa instead of doing her homework doesn't mean you can do it too.",D,"D. Your friend going to the spa instead of doing her homework doesn't mean you can do it too.

Letter: D."
93,Mary should not have dropped out of school to follow in the footsteps of her favorite writer.,"A. I would have preferred a house of my own rather than sharing, but beggars can't be choosers, I suppose.
B. As the flame extinguished, it left behind a thin wisp of smoke.
C. You should not be using your pen for gossip and rumors, even though other media reporters are doing so.
D. She tried to hand over the hardest part of the assignment on me so she doesn't have to do it.",C,"D is the most analogous sentence to the target sentence.

Explanation:

In the target sentence, Mary made a decision to drop out of school and follow her favorite writer's footsteps, which is not a preferred choice in the given context. Similarly, in option D, the other person is trying to pass on the difficult part of the assignment to someone else, which is not a preferred choice in that situation. Both sentences involve making a decision that is not the preferred or ideal choice in a particular context."
94,"It was a fantastic vacation, but all good things come to an end.","A. A journey of a thousand miles begins with a single step.
B. The management made it clear that the employees had to be on board with the new policies or they would be let go.
C. I have had a great time in college, but tomorrow I will be graduating.
D. My tiny daily coffee expenses are draining up all my income.",C,"C. I have had a great time in college, but tomorrow I will be graduating.

Analogous sentence: D. My years of hard work and dedication have led me to this point of success, but all good things come to an end. (A)journey of a thousand miles begins with a single step. (B)The management made it clear that the employees had to be on board with the new policies or they would be let go. (C)I have had a great time in college, but tomorrow I will be graduating. (D)My tiny daily coffee expenses are draining up all my income.

The closest sentence to the target sentence in terms of meaning would be: My years of hard work and dedication have led me to this point of success, but all good things come to an end. This sentence highlights the idea that success and good things are temporary and will eventually come to an end, just like how vacations and college experiences come to an end."
95,"Sachin is said to be the best cricketer in the world, but like every other player, he had to retire.","A. After losing half of the soldiers, they had no other option but to use the tank to fight.
B. Don't be greedy, just take whatever they offer you as if you negotiate too much they might take the offer back.
C. While the president was immensely popular, he nevertheless had to step down at the conclusion of his term per the rules of the constitution.
D. He is the winner of three Grammy awards for god's sake! People consider him to be the god of rap.",C,C.
